{"$id":"https://single-image-studio.invalid/research/slice-10/schemas/gold-identity.slice10.v0.schema.json","$schema":"https://json-schema.org/draft/2020-12/schema","additionalProperties":false,"properties":{"candidateDependencyUsed":{"const":false},"candidateOutputUsed":{"const":false},"contentHash":{"pattern":"^[0-9a-f]{64}$","type":"string"},"evidenceBoundary":{"additionalProperties":false,"properties":{"c1":{"const":0},"e1":{"const":0},"formalEvidence":{"const":false},"g1":{"const":0},"o1":{"const":0},"productSupport":{"const":false},"r1Pipeline":{"const":0},"r1ProductRelease":{"const":0},"r1ProductValidation":{"const":0},"releaseAllowlist":{"const":"none"},"releaseApproved":{"const":0},"releaseRegistered":{"const":0},"u1":{"const":0},"v1":{"const":0}},"required":["c1","e1","formalEvidence","g1","o1","productSupport","r1Pipeline","r1ProductRelease","r1ProductValidation","releaseAllowlist","releaseApproved","releaseRegistered","u1","v1"],"type":"object"},"expectedCanonicalJson":{"maxLength":200000,"minLength":1,"type":"string"},"frozenAt":{"pattern":"^[0-9]{4}-[0-9]{2}-[0-9]{2}T[0-9]{2}:[0-9]{2}:[0-9]{2}\\.[0-9]{3}Z$","type":"string"},"id":{"pattern":"^[A-Za-z0-9][A-Za-z0-9._:@/-]{2,199}$","type":"string"},"independenceClaim":{"const":false},"manifestLocator":{"additionalProperties":false,"properties":{"id":{"pattern":"^[A-Za-z0-9][A-Za-z0-9._:@/-]{2,199}$","type":"string"},"path":{"maxLength":200000,"minLength":1,"type":"string"}},"required":["id","path"],"type":"object"},"operation":{"enum":["normalize","export"]},"partition":{"enum":["dev/calibration","defect/calibration"]},"priorGoldRef":{"additionalProperties":false,"properties":{"byteLength":{"minimum":2,"type":"integer"},"contentHash":{"pattern":"^[0-9a-f]{64}$","type":"string"},"fileSha256":{"pattern":"^[0-9a-f]{64}$","type":"string"},"id":{"pattern":"^[A-Za-z0-9][A-Za-z0-9._:@/-]{2,199}$","type":"string"},"path":{"maxLength":500,"minLength":3,"pattern":"^[^\\\\/][^\\\\]*$","type":"string"}},"required":["byteLength","contentHash","fileSha256","id","path"],"type":"object"},"priorNormalizedArtifactRef":{"oneOf":[{"type":"null"},{"additionalProperties":false,"properties":{"byteLength":{"minimum":2,"type":"integer"},"contentHash":{"pattern":"^[0-9a-f]{64}$","type":"string"},"fileSha256":{"pattern":"^[0-9a-f]{64}$","type":"string"},"id":{"pattern":"^[A-Za-z0-9][A-Za-z0-9._:@/-]{2,199}$","type":"string"},"path":{"maxLength":500,"minLength":3,"pattern":"^[^\\\\/][^\\\\]*$","type":"string"}},"required":["byteLength","contentHash","fileSha256","id","path"],"type":"object"}]},"schemaVersion":{"const":"gold-identity.slice10.v0"},"sourceRef":{"additionalProperties":false,"properties":{"byteLength":{"minimum":2,"type":"integer"},"contentHash":{"pattern":"^[0-9a-f]{64}$","type":"string"},"fileSha256":{"pattern":"^[0-9a-f]{64}$","type":"string"},"id":{"pattern":"^[A-Za-z0-9][A-Za-z0-9._:@/-]{2,199}$","type":"string"},"path":{"maxLength":500,"minLength":3,"pattern":"^[^\\\\/][^\\\\]*$","type":"string"}},"required":["byteLength","contentHash","fileSha256","id","path"],"type":"object"}},"required":["schemaVersion","id","operation","partition","sourceRef","manifestLocator","priorGoldRef","priorNormalizedArtifactRef","expectedCanonicalJson","candidateOutputUsed","candidateDependencyUsed","independenceClaim","frozenAt","evidenceBoundary","contentHash"],"type":"object"}
