{"candidateDependencyUsed":false,"candidateOutputUsed":false,"contentHash":"dab5d73dadb6df15ebd4788e8d27aeb9dcd35001e427fb51c3f10711c804dec5","evidenceBoundary":{"c1":0,"e1":0,"formalEvidence":false,"g1":0,"o1":0,"productSupport":false,"r1Pipeline":0,"r1ProductRelease":0,"r1ProductValidation":0,"releaseAllowlist":"none","releaseApproved":0,"releaseRegistered":0,"u1":0,"v1":0},"expectedCanonicalJson":"{\"alphaMode\":\"straight-unpremultiplied\",\"alphaPresent\":true,\"animation\":\"forbidden\",\"colorSpace\":\"embedded-sRGB\",\"decodedPixelSha256\":\"eb75075a9d02a60f2b50fe816770b8dd29aed78c8447278484862d14be4e6158\",\"fileSha256\":null,\"height\":20,\"interlace\":\"forbidden\",\"metadataPolicy\":\"strip-all-except-color-contract\",\"mime\":\"image/png\",\"orientation\":1,\"parentIdentity\":{\"artifactSha256\":null,\"decodedPixelSha256\":\"eb75075a9d02a60f2b50fe816770b8dd29aed78c8447278484862d14be4e6158\",\"fileSha256\":\"df7d242493d88adb5e6472685c3b1c68746313eaba3a112a4cff7ee77ed17e13\",\"id\":\"raw.s05.normalize.dev.018\",\"manifestSha256\":\"1a987af3a290f26a9339a833c93a0d65478630049cf026bf8aeac4f9b5598ef5\"},\"pixelLayout\":\"RGBA8\",\"pngFilterPolicy\":\"filter-0-only\",\"width\":22}","frozenAt":"2026-08-15T18:03:39.680Z","id":"gold-identity.s10.normalize.dev.018","independenceClaim":false,"manifestLocator":{"id":"FM-OPEN-CALIBRATION-NORMALIZE-DEV@0.10.0","path":"manifests/normalize-dev.v0.10.0.json"},"operation":"normalize","partition":"dev/calibration","priorGoldRef":{"byteLength":1708,"contentHash":"a368e65c4f3ad6bdd4541358ea2b119f855dd35a69a9d02636226698013f20a2","fileSha256":"1208b220f7aab592bba18757e198bd0b064aeb208c63f4eb0e185aacd7d23c2e","id":"gold.raw.s05.normalize.dev.018","path":"research/slice-05/gold/normalize-dev/gold.raw.s05.normalize.dev.018.json"},"priorNormalizedArtifactRef":null,"schemaVersion":"gold-identity.slice10.v0","sourceRef":{"byteLength":2160,"contentHash":"393978e4678d727b238fa6a03a21ed1206a9b100e0724b4e78c7c09b8bee8899","fileSha256":"ee3a3ad84d9341255fdeb449d07fe856209d6587552e0d4029e58cd97dc890b5","id":"s10.normalize.dev.018","path":"source-lineage/normalize/dev-calibration/s10.normalize.dev.018.json"}}
