{"candidateDependencyUsed":false,"candidateOutputUsed":false,"contentHash":"07c594bb59f34cb403f8412ff527f2f4f5cb95f604df21f24088b61126870fa8","evidenceBoundary":{"c1":0,"e1":0,"formalEvidence":false,"g1":0,"o1":0,"productSupport":false,"r1Pipeline":0,"r1ProductRelease":0,"r1ProductValidation":0,"releaseAllowlist":"none","releaseApproved":0,"releaseRegistered":0,"u1":0,"v1":0},"expectedCanonicalJson":"{\"alphaMode\":\"straight-unpremultiplied\",\"alphaPresent\":false,\"animation\":\"forbidden\",\"colorSpace\":\"embedded-sRGB\",\"decodedPixelSha256\":\"d33372e8b609c77d8d27362dbaad626ae98d03d91d3b76388eb472daa66d4050\",\"fileSha256\":null,\"height\":8,\"interlace\":\"forbidden\",\"metadataPolicy\":\"strip-all-except-color-contract\",\"mime\":\"image/png\",\"orientation\":1,\"parentIdentity\":{\"artifactSha256\":null,\"decodedPixelSha256\":\"d33372e8b609c77d8d27362dbaad626ae98d03d91d3b76388eb472daa66d4050\",\"fileSha256\":\"2e91afeb0adac22a12f10663819d767aee4554f8730dd538733d61a0d916b0f8\",\"id\":\"raw.s05.normalize.dev.001\",\"manifestSha256\":\"5bdacfc822f2a44efc5720d5936dac4b6bee433a5889998cd7ddc11d96edb72b\"},\"pixelLayout\":\"RGBA8\",\"pngFilterPolicy\":\"filter-0-only\",\"width\":22}","frozenAt":"2026-08-15T18:03:39.680Z","id":"gold-identity.s10.normalize.dev.001","independenceClaim":false,"manifestLocator":{"id":"FM-OPEN-CALIBRATION-NORMALIZE-DEV@0.10.0","path":"manifests/normalize-dev.v0.10.0.json"},"operation":"normalize","partition":"dev/calibration","priorGoldRef":{"byteLength":1708,"contentHash":"ae8ba21c46cf6a707bef2366b2f4cd9b8c622f37d2046c97b4b33d94a8960cf1","fileSha256":"cfaf6a37a90dbba6bd4012bdd0a76bcd392990c97a9f5d4ed4ea7cef33bbc2ff","id":"gold.raw.s05.normalize.dev.001","path":"research/slice-05/gold/normalize-dev/gold.raw.s05.normalize.dev.001.json"},"priorNormalizedArtifactRef":null,"schemaVersion":"gold-identity.slice10.v0","sourceRef":{"byteLength":2154,"contentHash":"9a0ec336f10e43ec1eb89c83943ac362150d13bb57f663083357ea70e3ae4e03","fileSha256":"1783615e117ca7db1ef5be452df5681b1019bb8d06bebd056ac3011d30594d5b","id":"s10.normalize.dev.001","path":"source-lineage/normalize/dev-calibration/s10.normalize.dev.001.json"}}
