{"candidateDependencyUsed":false,"candidateOutputUsed":false,"contentHash":"c7c964881accaa03782feaec9ec631bcaa0029abb89c70ca0e5f351253fc7dc8","evidenceBoundary":{"c1":0,"e1":0,"formalEvidence":false,"g1":0,"o1":0,"productSupport":false,"r1Pipeline":0,"r1ProductRelease":0,"r1ProductValidation":0,"releaseAllowlist":"none","releaseApproved":0,"releaseRegistered":0,"u1":0,"v1":0},"expectedCanonicalJson":"{\"alphaMode\":\"straight-unpremultiplied\",\"alphaPresent\":true,\"animation\":\"forbidden\",\"colorSpace\":\"embedded-sRGB\",\"decodedPixelSha256\":\"8558bc9de16c79a3e7a583400f072d4cadd6679c2271223213ef65769f60773d\",\"fileSha256\":null,\"height\":16,\"interlace\":\"forbidden\",\"metadataPolicy\":\"strip-all-except-color-contract\",\"mime\":\"image/png\",\"orientation\":1,\"parentIdentity\":{\"artifactSha256\":null,\"decodedPixelSha256\":\"8558bc9de16c79a3e7a583400f072d4cadd6679c2271223213ef65769f60773d\",\"fileSha256\":\"9852d366c4ae5af30deb3e80e988f67e361fe57204f64982a427fcdcf7434f29\",\"id\":\"raw.s05.normalize.dev.017\",\"manifestSha256\":\"0f6b18238edff680747fac5936daf419f6d231f1fa193240e4d3d9e62c8b9a93\"},\"pixelLayout\":\"RGBA8\",\"pngFilterPolicy\":\"filter-0-only\",\"width\":20}","frozenAt":"2026-08-15T18:03:39.680Z","id":"gold-identity.s10.normalize.dev.017","independenceClaim":false,"manifestLocator":{"id":"FM-OPEN-CALIBRATION-NORMALIZE-DEV@0.10.0","path":"manifests/normalize-dev.v0.10.0.json"},"operation":"normalize","partition":"dev/calibration","priorGoldRef":{"byteLength":1708,"contentHash":"16f126c042a34efc4cc0eff21facdb424423e7e7ea39ff2c8402f7280807c8cc","fileSha256":"0d525db7207490c1b3f8fa219cfae836355accb805352eade4fa8127b2d83bdc","id":"gold.raw.s05.normalize.dev.017","path":"research/slice-05/gold/normalize-dev/gold.raw.s05.normalize.dev.017.json"},"priorNormalizedArtifactRef":null,"schemaVersion":"gold-identity.slice10.v0","sourceRef":{"byteLength":2160,"contentHash":"34ab0b35047b521808744d9e232e230db540dec18e2015165a6bc5cc3584fb99","fileSha256":"e88ef7f7fe7248c3b50af4be1b03ece3d2039831dc159c65d43cadefb329d659","id":"s10.normalize.dev.017","path":"source-lineage/normalize/dev-calibration/s10.normalize.dev.017.json"}}
