{"candidateDependencyUsed":false,"candidateOutputUsed":false,"contentHash":"924479ccadf17c91cff7f194fc0d1ed8e57f6e626c17a009acae2703b8367d3e","evidenceBoundary":{"c1":0,"e1":0,"formalEvidence":false,"g1":0,"o1":0,"productSupport":false,"r1Pipeline":0,"r1ProductRelease":0,"r1ProductValidation":0,"releaseAllowlist":"none","releaseApproved":0,"releaseRegistered":0,"u1":0,"v1":0},"expectedCanonicalJson":"{\"alphaMode\":\"straight-unpremultiplied\",\"alphaPresent\":true,\"animation\":\"forbidden\",\"colorSpace\":\"embedded-sRGB\",\"decodedPixelSha256\":\"ebc188958345b163f0315853e57adf0d4278f3d808be1379c952278e95d94022\",\"fileSha256\":null,\"height\":14,\"interlace\":\"forbidden\",\"metadataPolicy\":\"strip-all-except-color-contract\",\"mime\":\"image/png\",\"orientation\":1,\"parentIdentity\":{\"artifactSha256\":\"2c0db6d0f486cb51017d4538995a40955942be0beb60e5ed117bb42bde5f786f\",\"decodedPixelSha256\":\"ebc188958345b163f0315853e57adf0d4278f3d808be1379c952278e95d94022\",\"fileSha256\":\"1dea31f0db0f45b6dfc0a3abc2c32c8ffd82e3133f14d01914c9cdbe44e19001\",\"id\":\"normalized.s05.export.dev.015\",\"manifestSha256\":\"ac09a54c5906452ba21261f314746cad05ef6dabacf0d6d9cb9ba8cc563d52fb\"},\"pixelLayout\":\"RGBA8\",\"pngFilterPolicy\":\"filter-0-only\",\"width\":24}","frozenAt":"2026-08-15T18:03:39.680Z","id":"gold-identity.s10.export.dev.015","independenceClaim":false,"manifestLocator":{"id":"FM-OPEN-CALIBRATION-EXPORT-DEV@0.10.0","path":"manifests/export-dev.v0.10.0.json"},"operation":"export","partition":"dev/calibration","priorGoldRef":{"byteLength":1779,"contentHash":"1e2f8ed2513a0f69cf35c85087f497856f17781c62348abe38b3acba6d4392ee","fileSha256":"0b155f73e827176cbb3350789b3b213712340a5a255287ec499b697261f989e0","id":"gold.normalized.s05.export.dev.015","path":"research/slice-05/gold/export-dev/gold.normalized.s05.export.dev.015.json"},"priorNormalizedArtifactRef":{"byteLength":2613,"contentHash":"2c0db6d0f486cb51017d4538995a40955942be0beb60e5ed117bb42bde5f786f","fileSha256":"26bc6d46187072c7a4712558273bdb052f1c8b6c524fafd30a1fbaeec8fdd4c4","id":"normalized.s05.export.dev.015","path":"research/slice-05/artifacts/normalized-inputs/export-dev/normalized.s05.export.dev.015.json"},"schemaVersion":"gold-identity.slice10.v0","sourceRef":{"byteLength":2451,"contentHash":"4cad304988ec16bea448d12d5caae7bc5da05a95914e72237e61abb14227d204","fileSha256":"bb0a01da4d75dfbb9743b4fe15fc59364062f1e16ea2e26ab920bfb5027d51d2","id":"s10.export.dev.015","path":"source-lineage/export/dev-calibration/s10.export.dev.015.json"}}
